{
  "acceptance": {
    "description": "generated change returns integer 42",
    "expected_integer": 42
  },
  "category": "debug-repair",
  "id": "heldout-debug-call",
  "max_repair_rounds": 2,
  "prompt": "../../../shared/heldout-debug-call/prompt.md",
  "representations": [
    {
      "artifact": "../../../shared/heldout-debug-call/reference.patch",
      "artifact_kind": "patch",
      "compile_commands": [
        [
          "{repo}/target/debug/tacitra",
          "check",
          "{work}/program.taci"
        ]
      ],
      "diagnostic_context": [
        "../../../shared/heldout-debug-call/diagnostic.json"
      ],
      "id": "tacitra-diagnostic-patch",
      "language": "tacitra",
      "prepare_commands": [
        [
          "patch",
          "--silent",
          "{work}/program.taci",
          "{artifact}"
        ]
      ],
      "repository_context": [
        "../../../shared/heldout-debug-call/base.taci"
      ],
      "result_kind": "integer",
      "setup_files": [
        {
          "source": "../../../shared/heldout-debug-call/base.taci",
          "target": "program.taci"
        }
      ],
      "specification": [
        "../../../../../docs/language/syntax.md",
        "../../../../../docs/language/semantics.md",
        "../../../../../docs/language/diagnostics.md"
      ],
      "surface": "human-source",
      "test_commands": [
        [
          "{repo}/target/debug/tacitra",
          "run",
          "{work}/program.taci"
        ]
      ]
    }
  ],
  "schema_version": 2
}
