{
  "schema_version": 2,
  "id": "repository-increment",
  "category": "repository-change",
  "prompt": "prompt.md",
  "acceptance": {"description": "patched unchanged entry point produces integer 42", "expected_integer": 42},
  "max_repair_rounds": 2,
  "representations": [
    {"id":"python-source-patch","language":"python","surface":"human-source","artifact":"change.py.patch","artifact_kind":"patch","specification":["../../specs/python-v1.md"],"repository_context":["base.py"],"diagnostic_context":[],"setup_files":[{"source":"base.py","target":"program.py"}],"prepare_commands":[["patch","--silent","{work}/program.py","{artifact}"]],"compile_commands":[["python3","-m","py_compile","{work}/program.py"]],"test_commands":[["python3","{work}/program.py"]],"result_kind":"integer"},
    {"id":"go-source-patch","language":"go","surface":"human-source","artifact":"change.go.patch","artifact_kind":"patch","specification":["../../specs/go-v1.md"],"repository_context":["base.go"],"diagnostic_context":[],"setup_files":[{"source":"base.go","target":"program.go"}],"prepare_commands":[["patch","--silent","{work}/program.go","{artifact}"]],"compile_commands":[["go","build","-o","{work}/program","{work}/program.go"]],"test_commands":[["{work}/program"]],"result_kind":"integer"},
    {"id":"rust-source-patch","language":"rust","surface":"human-source","artifact":"change.rs.patch","artifact_kind":"patch","specification":["../../specs/rust-v1.md"],"repository_context":["base.rs"],"diagnostic_context":[],"setup_files":[{"source":"base.rs","target":"program.rs"}],"prepare_commands":[["patch","--silent","{work}/program.rs","{artifact}"]],"compile_commands":[["{rustc}","--edition=2021","{work}/program.rs","-o","{work}/program"]],"test_commands":[["{work}/program"]],"result_kind":"integer"},
    {"id":"tacitra-source-patch","language":"tacitra","surface":"human-source","artifact":"change.taci.patch","artifact_kind":"patch","specification":["../../../docs/language/syntax.md","../../../docs/language/semantics.md"],"repository_context":["base.taci"],"diagnostic_context":[],"setup_files":[{"source":"base.taci","target":"program.taci"}],"prepare_commands":[["patch","--silent","{work}/program.taci","{artifact}"]],"compile_commands":[["{repo}/target/debug/tacitra","check","{work}/program.taci"]],"test_commands":[["{repo}/target/debug/tacitra","run","{work}/program.taci"]],"result_kind":"integer"},
    {"id":"tacitra-semantic-patch","language":"tacitra","surface":"semantic-query","artifact":"semantic.patch.json","artifact_kind":"patch","specification":["../../../docs/language/syntax.md","../../../docs/language/semantics.md","../../../docs/agent-protocol.md"],"repository_context":["query.json"],"diagnostic_context":[],"setup_files":[{"source":"base.taci","target":"program.taci"}],"prepare_commands":[["{repo}/target/debug/tacitra","patch.apply","{work}/program.taci","{artifact}"]],"compile_commands":[["{repo}/target/debug/tacitra","check","{work}/program.taci"]],"test_commands":[["{repo}/target/debug/tacitra","run","{work}/program.taci"]],"result_kind":"integer"}
  ]
}
