{"schema_version":2,"id":"repository-increment","category":"repository-change","prompt":"../../../../cases/repository-increment/prompt.md","acceptance":{"description":"patched unchanged entry point produces integer 42","expected_integer":42},"max_repair_rounds":2,"representations":[{"id":"tacitra-source-patch","language":"tacitra","surface":"human-source","artifact":"../../../../cases/repository-increment/change.taci.patch","artifact_kind":"patch","specification":["../../../../specs/tacitra-core-v1.md"],"repository_context":["../../../../cases/repository-increment/base.taci"],"diagnostic_context":[],"setup_files":[{"source":"../../../../cases/repository-increment/base.taci","target":"program.taci"}],"prepare_commands":[["patch","--silent","{work}/program.taci","{artifact}"]],"compile_commands":[["{repo}/target/debug/tacitra","check","{work}/program.taci"]],"test_commands":[["{repo}/target/debug/tacitra","run","{work}/program.taci"]],"result_kind":"integer"},{"id":"tacitra-semantic-patch","language":"tacitra","surface":"semantic-query","artifact":"../../../../cases/repository-increment/semantic.patch.json","artifact_kind":"patch","specification":["../../../../specs/tacitra-core-v1.md","../../../../specs/tacitra-edit-v1.md"],"repository_context":["../../../../cases/repository-increment/query.json"],"diagnostic_context":[],"setup_files":[{"source":"../../../../cases/repository-increment/base.taci","target":"program.taci"}],"prepare_commands":[["{repo}/target/debug/tacitra","patch.apply","{work}/program.taci","{artifact}"]],"compile_commands":[["{repo}/target/debug/tacitra","check","{work}/program.taci"]],"test_commands":[["{repo}/target/debug/tacitra","run","{work}/program.taci"]],"result_kind":"integer"}]}
